Product_Code,Product_Label
120242,"Ground-nuts; other than seed, not roasted or otherwise cooked, shelled, whether or not broken,"
120300,Copra
120400,"Oil seeds; linseed, whether or not broken"
120510,"Oil seeds; low erucic acid rape or colza seeds, whether or not broken"
120590,"Oil seeds; rape or colza seeds, other than low erucic, whether or not broken"
120600,"Oil seeds; sunflower seeds, whether or not broken"
120710,"Oil seeds; palm nuts and kernels, whether or not broken"
120729,"Oil seeds; cotton seeds, other than seed, whether or not broken"
120730,"Oil seeds; castor oil seeds, whether or not broken"
120740,"Oil seeds; sesamum seeds, whether or not broken"
120750,"Oil seeds; mustard seeds, whether or not broken"
120760,"Oil seeds; safflower (Carthamus tinctorius) seeds, whether or not broken"
120770,"Oil seeds; melon seeds, whether or not broken"
120791,"Oil seeds; poppy seeds, whether or not broken"
120799,"Oil seeds and oleaginous fruits; n.e.c. in heading no. 1207, whether or not broken"
B_DR02,Fats and oils
150710,"Vegetable oils; soya-bean oil and its fractions, crude, whether or not degummed, not chemically modified"
150790,"Vegetable oils; soya-bean oil and its fractions, other than crude, whether or not refined, but not chemically modified"
150810,"Vegetable oils; ground-nut oil and its fractions, crude, not chemically modified"
150890,"Vegetable oils; ground-nut oil and its fractions, other than crude, whether or not refined, but not chemically modified"
150910,"Vegetable oils; olive oil and its fractions, virgin, whether or not refined, but not chemically modified"
150990,"Vegetable oils; olive oil and its fractions, other than virgin, whether or not refined, but not chemically modified"
151000,"Vegetable oils; oils and their fractions n.e.c. in chapter 15, obtained solely from olives, whether or not refined, but not chemically modified, including blends of these oils or fractions with oils or fractions of heading no. 1509"
151110,"Vegetable oils; palm oil and its fractions, crude, not chemically modified"
151190,"Vegetable oils; palm oil and its fractions, other than crude, whether or not refined, but not chemically modified"
151211,"Vegetable oils; sunflower seed or safflower oil and their fractions, crude, not chemically modified"
151219,"Vegetable oils; sunflower seed or safflower oil and their fractions, other than crude, whether or not refined, but not chemically modified"
151221,"Vegetable oils; cotton-seed oil and its fractions; crude, whether or not gossypol has been removed, not chemically modified"
151229,"Vegetable oils; cotton-seed oil and its fractions, other than crude, whether or not refined, but not chemically modified"
151311,"Vegetable oils; coconut (copra) oil and its fractions, crude, not chemically modified"
151319,"Vegetable oils; coconut (copra) oil and its fractions, other than crude, whether or not refined, but not chemically modified"
151321,"Vegetable oils; palm kernel or babassu oil and their fractions, crude, not chemically modified"
151329,"Vegetable oils; palm kernel or babassu oil and their fractions, other than crude, whether or not refined, but not chemically modified"
151411,"Vegetable oils; low erucic acid rape or colza oil and its fractions, crude"
151419,"Vegetable oils; low erucic acid rape or colza oil and its fractions, other than crude, but not chemically modified"
151491,"Vegetable oils; excluding low erucic acid rape or colza oil and its fractions, crude"
151499,"Vegetable oils; excluding low erucic acid rape or colza oil and its fractions, other than crude, but not chemically modified"
151511,"Vegetable oils; linseed oil and its fractions, crude, not chemically modified"
151519,"Vegetable oils; linseed oil and its fractions, other than crude, whether or not refined, but not chemically modified"
151521,"Vegetable oils; maize (corn) oil and its fractions, crude, not chemically modified"
151529,"Vegetable oils; maize (corn) oil and its fractions, other than crude, whether or not refined, but not chemically modified"
151530,"Vegetable oils; castor oil and its fractions, whether or not refined, but not chemically modified"
151550,"Vegetable oils; sesame oil and its fractions, whether or not refined, but not chemically modified"
151590,"Vegetable fats and oils and their fractions; fixed, n.e.c. in heading no. 1515, whether or not refined, but not chemically modified"
151620,"Vegetable fats and oils and their fractions; partly or wholly hydrogenated, inter-esterified, re-esterified or elaidinised, whether or not refined, but not further prepared"
B_DR03,Waxes
152110,Vegetable waxes (other than triglycerides); whether or not refined or coloured
350710,Enzymes; rennet and concentrates thereof
350790,Enzymes and prepared enzymes; other than rennet and concentrates thereof
B_DS,"Animal fats, oils, waxes and cleavage products"
B_DS01,Fats and oils
150110,"Pig fat; lard, other than that of heading 0209 and 1503"
150120,"Pig fat; not lard, other than that of heading 0209 or 1503"
150190,Poultry fat; other than that of heading 0209 or 1503
150210,Tallow; other than those of heading 1503
150290,"Fats of bovine animals, sheep or goats; excluding tallow, and other than those of heading 1503"
150300,"Lard stearin, lard oil, oleostearin, oleo-oil and tallow oil; not emulsified or mixed or otherwise prepared"
150410,"Oils of fish; fish-liver oils and their fractions, whether or not refined, but not chemically modified"
150420,"Fats and oils and their fractions; of fish, (excluding liver-oils)"
150430,Fats and oils and their fractions; of marine mammals
150500,Wool grease and fatty substances derived therefrom (including lanolin)
150600,"Animal fats and oils and their fractions; whether or not refined, but not chemically modified, n.e.c. in chapter 15"
151610,"Animal fats and oils and their fractions; partly or wholly hydrogenated, inter-esterified, re-esterified or elaidinised, whether or not refined, but not further prepared"
151800,"Animal or vegetable fats and oils and their fractions; oxidised, boiled or otherwise chemically modified, (excluding those of heading no. 1516), inedible mixtures or preparations of fats or oils"
B_DS02,Waxes
152190,"Waxes, other than vegetable, n.e.c. in heading no. 1521; whether or not refined or coloured"
B_DS03,Cleavage products
152200,Degras; residues resulting from the treatment of fatty substances or animal or vegetable waxes
391310,"Polymers, natural; alginic acid, its salts and esters, in primary forms"
B_E,"Perfumery, cosmetic, personal care and room care preparations"
B_EA,Perfumes and toilet waters
B_EB,Cosmetic preparations
B_EC,Personal care preparations
330300,Perfumes and toilet waters
B_ED,Room care preparations
330410,Cosmetic and toilet preparations; lip make-up
330420,Cosmetic and toilet preparations; eye make-up
330430,Cosmetic and toilet preparations; manicure or pedicure preparations
330491,"Cosmetic and toilet preparations; powders, whether or not compressed (excluding lip, eye, manicure or pedicure preparations)"
330499,"Cosmetic and toilet preparations; n.e.c. in heading no. 3304, for the care of the skin (excluding medicaments, including sunscreen or sun tan preparations)"
330510,Hair preparations; shampoos
330590,Hair preparations; n.e.c. in heading no. 3305
330610,Oral or dental hygiene preparations; dentifrices
330620,Oral or dental hygiene preparations; yarn used to clean between the teeth (dental floss)
330690,Oral or dental hygiene preparations; other than dentifrices
330710,"Perfumery, cosmetic or toilet preparations; pre-shave, shaving or after-shave preparations"
330720,"Perfumery, cosmetic or toilet preparations; personal deodorants and antiperspirants"
330730,"Perfumery, cosmetic or toilet preparations; perfumed bath salts and other bath preparations"
330790,Perfumes and deodorizers; perfuming or deodorizing preparations n.e.c. in heading no. 3307
340111,"Soap and organic surface-active products; in the form of bars, cakes, moulded shapes, and paper, wadding, felt and nonwovens, impregnated, coated or covered with soap or detergent, for toilet use (including medicated products)"
340120,Soap; in forms n.e.c. in item no. 3401.11
340130,"Organic surface-active products and preparations for washing the skin, in the form of liquid or cream and put up for retail sale, whether or not containing soap"
330741,"Perfumes and deodorizers; perfuming or deodorizing preparations for rooms, agarbatti and other odoriferous preparations which operate by burning (including those used during religious rites)"
330749,"Perfumes and deodorizers; perfuming or deodorizing preparations for rooms, (excluding those which operate by burning)"
340119,"Soap and organic surface-active products; in the form of bars, cakes, moulded shapes, and paper, wadding, felt and nonwovens, impregnated, coated or covered with soap or detergent, not for toilet use"
B_F,Pharmaceuticals
B_FA,Animal products used in the preparation of pharmaceutical products
051000,"Animal products; ambergris, castoreum, civet, musk, cantharides, bile (dried or not) glands and other animal products, for pharmaceutical purposes, fresh, chilled, frozen or otherwise provisionally preserved"
B_FB,Pharmaceutical products
294110,Antibiotics; penicillins and their derivatives with a penicillanic acid structure; salts thereof
294120,Antibiotics; streptomycins and their derivatives; salts thereof
294130,Antibiotics; tetracyclines and their derivatives; salts thereof
294140,Antibiotics; chloramphenicol and its derivatives; salts thereof
294150,Antibiotics; erythromycin and its derivatives; salts thereof
294190,Antibiotics; n.e.c. in heading no. 2941
300120,"Glands and other organs; extracts of glands or other organs or of their secretions, for organo-therapeutic uses"
300190,"Glands and other organs; heparin and its salts; other human or animal substances prepared for therapeutic or prophylactic uses, n.e.c. in heading 3001"
300211,"Blood, human or animal, antisera, other blood fractions and immunological products; malaria diagnostic test kits"
300212,"Blood, human or animal, antisera, other blood fractions and immunological products; antisera and other blood fractions"
300213,"Blood, human or animal, antisera, other blood fractions and immunological products; immunological products, unmixed, not put up in measured doses or in forms or packings for retail sale"
300214,"Blood, human or animal, antisera, other blood fractions and immunological products; immunological products, mixed, put up in measured doses or in forms or packings for retail sale"
300215,"Blood, human or animal, antisera, other blood fractions and immunological products; immunological products, put up in measured doses or in forms or packings for retail sale"
300219,"Blood, human or animal, antisera, other blood fractions and immunological products; n.e.c. in heading 3002.1"
300390,"Medicaments; (not containing antibiotics, hormones, alkaloids or their derivatives), for therapeutic or prophylactic uses, (not packaged for retail sale)"
300490,"Medicaments; consisting of mixed or unmixed products n.e.c. in heading no. 3004, for therapeutic or prophylactic uses, packaged for retail sale"
B_G,"Hides, skins, leather, furskins and products thereof"
B_GA,Hides and skins
B_GA01,Raw
B_GA02,Tanned or crust
410120,"Raw hides and skins; whole, unsplit, of bovine or equine animals, of a weight per skin not exceeding 8kg when simply dried, 10kg when dry-salted or 16kg when fresh, wet-salted or otherwise preserved"
410150,"Hides and skins; raw, whole, of bovine or equine animals, of a weight per skin exceeding 16 kg"
410190,"Hides and skins; other than whole, but including butts, bends and bellies, of bovine (including. buffalo) and equine animals, fresh, salted or preserved, but not tanned, parchment dressed or further prepared, whether or not dehaired or split"
410210,"Skins; raw, of sheep or lambs, fresh, or salted, dried, limed, pickled or otherwise preserved, (but not tanned, parchment-dressed or further prepared), with wool on"
410221,"Skins; raw, of sheep or lambs, pickled (but not tanned, parchment-dressed or further preserved), without wool on"
410229,"Hides and skins; raw, of animals n.e.c. in this chapter, fresh, salted, dried, limed, pickled or otherwise preserved, (but not tanned, parchment-dressed or further prepared), whether or not dehaired or split"
410320,"Hides and skins; raw, of reptiles (fresh or salted, dried, limed, pickled or otherwise preserved, but not tanned, parchment-dressed or further prepared), whether or not dehaired or split"
410330,"Hides and skins; raw, of swine, (fresh or salted, dried, limed, pickled or otherwise preserved, but not tanned, parchment-dressed or further prepared), whether or not dehaired or split"
410390,"Hides and skins; raw, of animals n.e.c. in this chapter, fresh, salted, dried, limed, pickled or otherwise preserved, (but not tanned, parchment-dressed or further prepared), whether or not dehaired or split"
410411,"Tanned or crust hides and skins; without hair on, bovine or equine, in the wet state (including wet blue), full grains, unsplit; grain splits"
410419,"Tanned or crust hides and skins; bovine or equine, without hair on, in the wet state (including wet blue), excluding full grains, unsplit; grain splits"
410441,"Tanned or crust hides and skins; bovine or equine, without hair on, in the dry state (crust), full grains, unsplit; grain splits"
410449,"Tanned or crust hides and skins; bovine or equine, without hair on, in the dry state (crust), (other than full grains, unsplit; grain splits)"
410510,"Tanned or crust skins of sheep or lambs, without wool on, whether or not split, but not further prepared, in the wet state (including wet-blue)"
410530,"Tanned or crust skins; of sheep or lambs, without wool on, whether or not split, but not further prepared, in the dry state (crust)"
410621,"Tanned or crust hides and skins; of goats or kids, without wool or hair on, whether or not split, but not further prepared, in the wet state (including wet blue)"
410622,"Tanned or crust hides and skins; of goats or kids, without hair on, whether or not split, but not further prepared, in the dry state (crust)"
410631,"Tanned or crust hides and skins; of swine, without hair on, whether or not split, but not further prepared, in the wet state (including wet blue)"
410632,"Tanned or crust hides and skins; of swine, without hair on, whether or not split, but not further prepared, in the dry state (crust)"
410640,"Tanned or crust hides and skins; of reptiles, whether or not split, but not further prepared"
410691,"Tanned or crust hides and skins; of animals other than equine, ovine, bovine, goats or kids, swine and reptiles, without wool or hair on, whether or not split, but not further prepared, in the wet state (including wet blue)"
410692,"Tanned or crust hides and skins; of animals other than equine, ovine, bovine, goats or kids, swine and reptiles, without wool or hair on, whether or not split, but not further prepared, in the dry state (crust)"
B_GB,Leather and articles thereof
B_GB01,Leather
B_GB02,Saddlery and harness for animals
B_GB03,"Travel goods, handbags and similar containers"
410711,"Leather; further prepared after tanning or crusting, including parchment-dressed leather, of bovine (including buffalo) or equine animals, without hair on, other than leather of heading 41.14, whole hides and skins, full grain, unsplit"
410712,"Leather; further prepared after tanning or crusting, including parchment-dressed leather, of bovine (including buffalo) or equine animals, without hair on, other than leather of heading 41.14, whole hides and skins, grain splits"
410719,"Leather; further prepared after tanning or crusting, including parchment-dressed, of bovine (including buffalo) or equine animals, without hair on, split or not, other than leather of heading 41.14, (other than grain splits and full grains, unsplit)"
410791,"Leather; further prepared after tanning or crusting, including parchment-dressed, of bovine (including buffalo) or equine animals, without hair on, other than leather of heading 41.14, not whole hides and skins, but including sides, full grain, unsplit"
410792,"Leather; further prepared after tanning or crusting, including parchment-dressed, of bovine (including buffalo) or equine animals, without hair on, other than leather of heading 41.14, not whole hides and skins, but including sides, grain splits"
410799,"Leather; further prepared after tanning or crusting, incl. parchment-dressed, of bovine (including buffalo) or equine animals, no hair, excluding leather of heading 41.14, and whole hides and skins, and sides, (full grains, unsplit and grain splits)"
411200,"Leather; further prepared after tanning or crusting, including parchment dressed leather, of sheep or lamb, without wool on, whether or not split, other than leather of heading 41.14"
411310,"Leather; further prepared after tanning or crusting, including parchment-dressed leather, without hair on, whether or not split, other than leather of heading 41.14, of goats and kids"
411320,"Leather; further prepared after tanning or crusting, including parchment-dressed leather, without hair on, whether or not split, other than leather of heading 41.14, of swine"
411330,"Leather; further prepared after tanning or crusting, including parchment-dressed leather, of reptiles, whether or not split, other than leather of heading 41.14"
411390,"Leather; further prepared after tanning or crusting, including parchment-dressed leather, of animals (other than sheep and lambs, goats and kids, swine and reptiles), without wool or hair on, whether or not split, other than leather of heading 41.14"
411410,Leather; chamois (including combination chamois)
411420,Leather; patent leather and laminated patent leather; metallised leather
411510,"Leather; composition leather with a basis of leather or leather fibre, in slabs, sheets or strip, whether or not in rolls"
411520,"Leather; parings and other waste, of leather or composition leather; not suitable for the manufacture of leather articles; leather dust, powder and flour"
B_GB04,Apparel and clothing accessories
420100,"Saddlery and harness; for any animal (including traces, leads, knee pads, muzzles, saddle cloths, saddle bags, dog coats and the like), of any materials"
B_GB05,Footwear
420211,"Cases and containers; trunks, suit-cases, vanity-cases, executive-cases, brief-cases, school satchels and similar containers, with outer surface of leather or of composition leather"
420221,"Cases and containers; handbags (whether or not with shoulder strap and including those without handle), with outer surface of leather or of composition leather"
420231,"Cases and containers; of a kind normally carried in the pocket or in the handbag, with outer surface of leather or of composition leather"
420291,"Cases and containers; n.e.c. in heading 4202, with outer surface of leather or of composition leather"
420310,"Apparel; articles of apparel, of leather or of composition leather"
420321,"Clothing accessories; gloves, mittens and mitts, specially designed for use in sports, of leather or composition leather, padded"
420329,"Clothing accessories; gloves, mittens and mitts, n.e.c. in heading no. 4203, of leather or composition leather, not specially designed for use in sports"
420330,"Clothing accessories; belts and bandoliers, of leather or of composition leather"
420340,"Clothing accessories; of leather or of composition leather, n.e.c. in heading no. 4203"
420500,"Leather articles; n.e.c. in chapter 42, of leather or composition leather"
640320,"Footwear; with outer soles of leather, uppers consisting of leather straps across instep and around the big toe"
640351,"Footwear; n.e.c. in heading no. 6403, with outer soles and uppers of leather, covering the ankle"
640359,"Footwear; n.e.c. in heading no. 6403, (not covering the ankle), outer soles and uppers of leather"
B_GC,Furskins and articles thereof
B_GC01,Furskins
B_GC02,Apparel and clothing accessories
430110,"Furskins; raw, of mink, whole, with or without head, tail or paws"
430130,"Furskins; raw, of Astrakhan, Broadtail, Caracul, Persian and similar lamb, Indian, Chinese, Mongolian or Tibetan lamb, whole, with or without head, tail or paws"
430160,"Furskins; raw, of fox, whole, with or without head, tail or paws"
430180,"Furskins; raw, of animals n.e.c. in heading no. 4301, whole, with or without head, tail or paws (excluding goods of heading no. 4101, 4102 and 4103)"
430190,"Furskins; raw, heads, tails, paws and other pieces or cuttings, suitable for furrier's use, excluding goods of heading no. 4101, 4102 and 4103"
430211,"Furskins; tanned or dressed, of mink, whole, with or without head, tail or paws, not assembled"
430219,"Furskins; tanned or dressed, whole, with or without head, tail or paws, not assembled, n.e.c. in heading no. 4302, excluding goods or heading no. 4303"
430220,"Furskins; tanned or dressed, heads, tails, paws and other pieces or cuttings, not assembled, excluding goods of heading no. 4303"
430230,"Furskins; tanned or dressed, whole skins and pieces or cuttings thereof, assembled, excluding goods of heading no. 4303"
430310,Furskin articles; apparel and clothing accessories
430390,Furskin articles; other than apparel and clothing accessories
B_H,Natural fibres and articles thereof
B_HA,Silk and articles thereof
B_HA01,Silk
B_HA02,Yarn
B_HA03,Fabrics
B_HA04,Articles of apparel and clothing accesories
500100,Silk; silk-worm cocoons suitable for reeling
500200,Silk; raw silk (not thrown)
500300,"Silk waste (including cocoons unsuitable for reeling, yarn waste and garnetted stock)"
500400,"Silk; yarn (other than yarn spun from silk waste), not put up for retail sale"
500500,"Silk; yarn spun from silk waste, not put up for retail sale"
500600,"Silk yarn and yarn spun from silk waste; put up for retail sale, and silk-worm gut"
500710,Silk; woven fabrics of noil silk
500720,"Silk; woven fabrics, containing 85% or more by weight of silk or of silk waste other than noil silk"
500790,Silk; woven fabrics n.e.c. in heading no. 5007
620610,"Blouses, shirts and shirt-blouses; women's or girls', of silk or silk waste (not knitted or crocheted)"
621410,"Shawls, scarves, mufflers, mantillas, veils and the like; of silk or silk waste (not knitted or crocheted)"
621510,"Ties, bow ties and cravats; of silk or silk waste (not knitted or crocheted)"
B_HB,"Wool, animal hair and articles thereof"
B_HB01,Wool and animal hair
B_HB02,Yarn
B_HB03,Fabrics
B_HB04,Felt
510111,"Wool; (not carded or combed), greasy (including fleece-washed wool), shorn"
510119,"Wool; (other than shorn), greasy (including fleece-washed wool), not carded or combed"
510121,"Wool; (not carded or combed), degreased, (not carbonised), shorn"
510129,"Wool; (not carded or combed), degreased, (not carbonised), (other than shorn)"
510130,"Wool; (not carded or combed), carbonised"
510211,"Hair; fine animal hair, not carded or combed, of kashmir (cashmere) goats"
510219,"Hair; fine animal hair, not carded or combed, other than of kashmir (cashmere) goats"
510220,"Hair; coarse animal hair, not carded or combed"
510310,"Wool and hair; noils of wool or of fine animal hair, including yarn waste, but excluding garnetted stock"
510320,"Wool and hair; waste of wool or of fine animal hair, including yarn waste, but excluding garnetted stock and noils of wool or of fine animal hair"
510330,"Wool and hair; waste of coarse animal hair, including yarn waste, but excluding garnetted stock"
510400,Wool and hair; garnetted stock of wool or of fine or coarse animal hair
510510,Wool; carded
510521,"Wool; wool tops and other combed wool, in fragments"
510529,"Wool; wool tops and other combed wool, other than in fragments"
510531,"Hair; fine animal hair, carded or combed, of kashmir (cashmere) goats"
510539,"Hair; fine animal hair, carded or combed, other than of kashmir (cashmere) goats"
510540,"Hair; coarse animal hair, carded or combed"
B_HB05,Carpets and other textile floor coverings
510610,"Yarn; of carded wool, containing 85% or more by weight of wool, not put up for retail sale"
510620,"Yarn; of carded wool, containing less than 85% by weight of wool, not put up for retail sale"
510710,"Yarn; of combed wool, containing 85% or more by weight of wool, not put up for retail sale"
510720,"Yarn; of combed wool, containing less than 85% by weight of wool, not put up for retail sale"
510810,"Yarn; of fine animal hair, carded, not put up for retail sale"
510820,"Yarn; of fine animal hair, combed, not put up for retail sale"
510910,"Yarn; of wool or of fine animal hair, containing 85% or more by weight of wool or fine animal hair, put up for retail sale"
510990,"Yarn; of wool or of fine animal hair, containing less than 85% by weight of wool or fine animal hair, put up for retail sale"
511000,"Yarn; of coarse animal hair or of horsehair (including gimped horsehair yarn), whether or not put up for retail sale"
B_HB06,Articles of apparel and clothing accesories
511111,"Fabrics, woven; of carded wool or of carded fine animal hair, containing 85% or more by weight of wool or of fine animal hair, of a weight not exceeding 300g/m2"
511119,"Fabrics, woven; of carded wool or of carded fine animal hair, containing 85% or more by weight of wool or of fine animal hair, of a weight exceeding 300g/m2"
511120,"Fabrics, woven; of carded wool or carded fine animal hair, containing less than 85% by weight of wool or fine animal hair, mixed mainly or solely with man-made filaments"
511130,"Fabrics, woven; of carded wool or carded fine animal hair, containing less than 85% by weight of wool or fine animal hair, mixed mainly or solely with man-made staple fibres"
511190,"Fabrics, woven; of carded wool or carded fine animal hair, containing less than 85% by weight of wool or fine animal hair, mixed mainly or solely with fibres n.e.c. in heading no. 5111"
