Product_Code,Product_Label
521152,"Fabrics, woven; containing less than 85% by weight of cotton, mixed mainly or solely with man-made fibres, weighing more than 200g/m2, printed, 3-thread or 4-thread twill, including cross twill"
521159,"Fabrics, woven; containing less than 85% by weight of cotton, mixed mainly or solely with man-made fibres, weighing more than 200g/m2, printed, of weaves n.e.c. in item no. 5211.5"
521211,"Fabrics, woven; of cotton, unbleached, weighing not more than 200g/m2, n.e.c. in chapter 52"
521212,"Fabrics, woven; of cotton, bleached, weighing not more than 200g/m2, n.e.c. in chapter 52"
521213,"Fabrics, woven; of cotton, dyed, weighing not more than 200g/m2, n.e.c. in chapter 52"
521214,"Fabrics, woven; of cotton, of yarns of different colours, weighing not more than 200g/m2, n.e.c. in chapter 52"
521215,"Fabrics, woven; of cotton, printed, weighing not more than 200g/m2, n.e.c. in chapter 52"
521221,"Fabrics, woven; of cotton, unbleached, weighing more than 200g/m2, n.e.c. in chapter 52"
521222,"Fabrics, woven; of cotton, bleached, weighing more than 200g/m2, n.e.c. in chapter 52"
521223,"Fabrics, woven; of cotton, dyed, weighing more than 200g/m2, n.e.c. in chapter 52"
521224,"Fabrics, woven; of cotton, of yarns of different colours, weighing more than 200g/m2, n.e.c. in chapter 52"
521225,"Fabrics, woven; of cotton, printed, weighing more than 200g/m2, n.e.c. in chapter 52"
580121,"Fabrics; woven pile, of cotton, uncut weft pile fabrics, other than fabrics of heading no. 5802 or 5806"
580122,"Fabrics; woven pile, of cotton, cut corduroy, other than fabrics of heading no. 5802 or 5806"
580123,"Fabrics; woven pile, of cotton, weft pile fabrics other than uncut and corduroy, other than fabrics of heading no. 5802 or 5806"
580126,"Fabrics; chenille, of cotton, other than fabrics of heading no. 5802 or 5806"
580127,"Fabrics; woven pile, of cotton, warp pile fabrics, other than fabrics of heading no. 5802 or 5806"
580211,"Fabrics; terry towelling and similar woven terry fabrics, of cotton, unbleached, excluding narrow fabrics of heading no. 5806"
580219,"Fabrics; terry towelling and similar woven terry fabrics, of cotton, bleached, excluding narrow fabrics of heading no. 5806"
580631,"Fabrics; narrow woven fabrics, n.e.c. in heading no. 5806, of cotton (excluding goods of heading no. 5807)"
581091,"Embroidery; with visible ground, of cotton, in the piece, in strips or in motifs"
600121,"Fabrics; looped pile fabrics, of cotton, knitted or crocheted"
600191,"Fabrics; pile fabrics (excluding long pile and loop pile), of cotton, knitted or crocheted"
600320,"Fabrics; knitted or crocheted fabrics, other than those of heading 60.01 and 60.02, of a width not exceeding 30 cm, of cotton"
600521,"Fabrics; warp knit (including those made on galloon knitting machines), other than those of headings 60.01 to 60.04, of cotton, unbleached or bleached"
600522,"Fabrics; warp knit (including those made on galloon knitting machines), other than those of headings 60.01 to 60.04, of cotton, dyed"
600523,"Fabrics; warp knit (including those made on galloon knitting machines), other than those of headings 60.01 to 60.04, of cotton, yarns of different colours"
600524,"Fabrics; warp knit (including those made on galloon knitting machines), other than those of headings 60.01 to 60.04, of cotton, printed"
600621,"Fabrics; knitted or crocheted fabrics, other than those of headings 60.01 to 60.04, of cotton, unbleached or bleached"
600622,"Fabrics; knitted or crocheted fabrics, other than those of headings 60.01 to 60.04, of cotton, dyed"
600623,"Fabrics; knitted or crocheted fabrics, other than those of headings 60.01 to 60.04, of cotton, of yarns of different colours"
600624,"Fabrics; knitted or crocheted fabrics, other than those of headings 60.01 to 60.04, of cotton, printed"
B_HC07,Blankets and travelling rugs
470610,Pulp; cotton linters pulp
B_HC08,"Bed linen, table linen, toilet linen and kitchen linen"
560121,"Wadding; other articles thereof, of cotton"
B_HC09,"Curtains, interior blinds and valances"
610120,"Coats; men's or boys' overcoats, car-coats, capes, anoraks, wind-jackets and similar articles, of cotton, knitted or crocheted (excluding those of heading no. 6103)"
610220,"Coats; women's or girls' overcoats, car-coats, capes, anoraks, wind-jackets and similar articles, of cotton, knitted or crocheted (excluding those of heading no. 6104)"
610322,"Ensembles; men's or boys', of cotton, knitted or crocheted"
610332,"Jackets and blazers; men's or boys', of cotton, knitted or crocheted"
610342,"Trousers, bib and brace overalls, breeches and shorts; men's or boys', of cotton, knitted or crocheted"
610422,"Ensembles; women's or girls', of cotton, knitted or crocheted"
610432,"Jackets; women's or girls', of cotton, knitted or crocheted"
610442,"Dresses; women's or girls', of cotton, knitted or crocheted"
610452,"Skirts and divided skirts; women's or girls', of cotton, knitted or crocheted"
610462,"Trousers, bib and brace overalls, breeches and shorts; women's or girls', of cotton, knitted or crocheted"
610510,"Shirts; men's or boys', of cotton, knitted or crocheted"
610610,"Blouses, shirts and shirt-blouses; women's or girls', of cotton, knitted or crocheted"
610711,"Underpants and briefs; men's or boys', of cotton, knitted or crocheted"
610721,"Nightshirts and pyjamas; men's or boys', of cotton, knitted or crocheted"
610791,"Bathrobes, dressing gowns and similar articles; men's or boys', of cotton, knitted or crocheted"
610821,"Briefs and panties; women's or girls', of cotton, knitted or crocheted"
610831,"Nightdresses and pyjamas; women's or girls', of cotton, knitted or crocheted"
610891,"Negligees, bathrobes, dressing gowns and similar articles; women's or girls', of cotton, knitted or crocheted"
610910,"T-shirts, singlets and other vests; of cotton, knitted or crocheted"
611020,"Jerseys, pullovers, cardigans, waistcoats and similar articles; of cotton, knitted or crocheted"
611120,"Garments and clothing accessories; babies', of cotton, knitted or crocheted"
611211,"Track suits; of cotton, knitted or crocheted"
611420,"Garments; of cotton, knitted or crocheted, n.e.c. in chapter 61"
611595,"Hosiery and footwear; without applied soles, of cotton, knitted or crocheted (excluding graduated compression hosiery, panty hose, tights, full or knee-length hosiery measuring per single yarn less than 67 decitex)"
611692,"Gloves, mittens and mitts; of cotton, knitted or crocheted, (other than impregnated, coated or covered with plastics or rubber)"
620112,"Coats; men's or boys', overcoats, raincoats, car-coats, capes, cloaks and similar articles, of cotton, other than those of heading no. 6203 (not knitted or crocheted)"
620192,Other furnishings
B_HC10,"Anoraks (including ski-jackets), wind-cheaters, wind-jackets and similar articles; men's or boys', of cotton, other than those of heading no. 6203 (not knitted or crocheted)"
620212,"Coats; women's or girls', overcoats, raincoats, car-coats, capes, cloaks and similar articles, of cotton, other than those of heading no. 6204 (not knitted or crocheted)"
620292,"Anoraks (including ski-jackets), wind-cheaters, wind-jackets and similar articles; women's or girls', of cotton, other than those of heading no. 6204 (not knitted or crocheted)"
620322,"Ensembles; men's or boys', of cotton (not knitted or crocheted)"
620332,"Jackets and blazers; men's or boys', of cotton (not knitted or crocheted)"
620342,"Trousers, bib and brace overalls, breeches and shorts; men's or boys', of cotton (not knitted or crocheted)"
620412,"Suits; women's or girls', of cotton (not knitted or crocheted)"
620422,"Ensembles; women's or girls', of cotton (not knitted or crocheted)"
620432,"Jackets and blazers; women's or girls', of cotton (not knitted or crocheted)"
620442,"Dresses; women's or girls', of cotton (not knitted or crocheted)"
620452,"Skirts and divided skirts; women's or girls', of cotton (not knitted or crocheted)"
620462,"Trousers, bib and brace overalls, breeches and shorts; women's or girls', of cotton (not knitted or crocheted)"
620520,"Shirts; men's or boys', of cotton (not knitted or crocheted)"
620630,"Blouses, shirts and shirt-blouses; women's or girls', of cotton (not knitted or crocheted)"
620711,"Underpants and briefs; men's or boys', of cotton (not knitted or crocheted)"
620721,"Nightshirts and pyjamas; men's or boys', of cotton (not knitted or crocheted)"
620791,"Singlets and other vests, bathrobes, dressing gowns and similar articles; men's or boys', of cotton (not knitted or crocheted)"
620821,"Nightdresses and pyjamas; women's or girls', of cotton (not knitted or crocheted)"
620891,"Singlets and other vests, briefs, panties, negligees, bathrobes, dressing gowns and similar articles; women's or girls', of cotton (not knitted or crocheted)"
620920,"Garments and clothing accessories; babies', of cotton (not knitted or crocheted)"
621132,"Track suits and other garments n.e.c.; men's or boys', of cotton (not knitted or crocheted)"
621142,"Track suits and other garments n.e.c.; women's or girls', of cotton (not knitted or crocheted)"
621320,Handkerchiefs; of cotton (not knitted or crocheted)
B_HC11,"Sacks and bags, of a kind used for the packing of goods"
630130,Blankets (other than electric blankets) and travelling rugs; of cotton
630221,"Bed linen; of cotton, printed, not knitted or crocheted"
630231,"Bed linen; of cotton (not printed, knitted or crocheted)"
630251,"Table linen; of cotton, not knitted or crocheted"
630260,"Kitchen and toilet linen; of terry towelling or similar terry fabrics, of cotton"
630291,"Toilet and kitchen linen; of cotton, excluding terry towelling or similar terry fabrics"
630391,"Curtains (including drapes) and interior blinds, curtain or bed valances; of cotton, not knitted or crocheted"
630492,"Furnishing articles; of cotton, not knitted or crocheted (excluding bedspreads and articles of heading no. 9404)"
630520,"Sacks and bags; of a kind used for the packing of goods, of cotton"
B_HD,Flax and articles thereof
B_HD01,Flax
B_HD02,Yarn
B_HD03,Fabrics
530110,"Flax; raw or retted, but not spun"
530121,"Flax; broken or scutched, but not spun"
530129,"Flax; hackled or otherwise processed, but not spun"
530130,"Flax; tow and waste, including yarn waste and garnetted stock"
530610,"Yarn; of flax, single"
530620,"Yarn; of flax, multiple (folded) or cabled"
530911,"Fabrics, woven; of flax, containing 85% or more flax, unbleached or bleached"
530919,"Fabrics, woven; of flax, containing 85% or more flax, other than bleached or unbleached"
530921,"Fabrics, woven; of flax, containing less than 85% flax, unbleached or bleached"
530929,"Fabrics, woven; of flax, containing less than 85% flax, other than unbleached or bleached"
B_HE,"Jute, other textile bast fibres and articles thereof"
B_HE01,Jute and other textile bast fibres
B_HE02,Yarn
B_HE03,Fabrics
B_HE04,"Sacks and bags, of a kind used for the packing of goods"
530310,"Jute and other textile bast fibres; raw or retted, but not spun, (excluding flax, hemp (cannabis sativa L.), and ramie)"
530390,"Jute and other textile bast fibres; processed but not spun, tow and waste of these fibres, including yarn waste and garnetted stock (excluding flax, hemp (cannabis sativa L.), and ramie)"
530710,"Yarn; of jute or of other textile bast fibres, single"
530720,"Yarn; of jute or of other textile bast fibres, multiple (folded) or cabled"
531010,"Fabrics, woven; of jute or of other textile bast fibres of heading no. 5303, unbleached"
531090,"Fabrics, woven; of jute or of other textile bast fibres of heading no. 5303, other than unbleached"
630510,"Sacks and bags; of a kind used for the packing of goods, of jute or of other textile bast fibres of heading no. 5303"
B_HF,"Sisal, other fibres of the Agave genus and articles thereof"
B_HF01,"Twine, cordage, ropes, cables, fishing nets and other nets, and articles thereof"
560721,"Twine; binder or baler twine, of sisal or other textile fibres of the genus agave"
560729,"Twine, cordage, ropes, cables; of sisal or other textile fibres of the genus agave (excluding binder or baler twine), whether or not plaited, braided or rubber or plastic impregnated, coated, covered or sheathed"
B_HG,"Other vegetable textile fibres, n.e.s.i., and articles thereof"
B_HG01,"Other vegetable textile fibres, n.e.s.i."
B_HG02,Yarn
B_HG03,Fabrics
B_HG04,Carpets and other textile floor coverings
530210,"Hemp (cannabis sativa L.); raw or retted, but not spun"
530290,"Hemp (cannabis sativa L.); processed (other than retted) (but not spun), true hemp tow and waste (including yarn waste and garnetted stock)"
530500,"Coconut, abaca (Manila hemp or Musa textilis Nee), ramie and other vegetable textile fibres n.e.c., raw or processed but not spun; tow, noils and waste of these fibres (including yarn waste and garnetted stock)"
530810,Yarn; of coir
530820,Yarn; of hemp (cannabis sativa L.)
530890,"Yarn; of vegetable textile fibres n.e.c. in heading no. 5306, 5307 and 5308"
531100,"Fabrics, woven; of vegetable textile fibres n.e.c. in heading no. 5309 and 5310, woven fabrics of paper yarn"
570220,"Carpets and other textile floor coverings; woven, (not tufted or flocked), whether or not made up, of coconut fibres (coir)"
570239,"Carpets and other textile floor coverings; woven, (not tufted or flocked), of textile materials (other than man-made, wool or fine animal hair), of pile construction, not made up, n.e.c. in item no. 5702.10 or 5702.20"
570249,"Carpets and other textile floor coverings; woven, (not tufted or flocked), of textile materials (other than man-made, wool or fine animal hair), of pile construction, made up, n.e.c. in item no. 5702.10 or 5702.20"
570299,"Carpets and other textile floor coverings; woven, (not tufted or flocked), of textile materials (other than man-made or wool or fine animal hair, not of pile construction), made up, n.e.c. in item no. 5702.10 or 5702.20"
B_HH,Articles of unspecified natural fibres
B_HH01,Wadding
B_HH02,Nonwovens
B_HH03,"Knotted netting of twine, cordage or rope; made up fishing nets and other made up nets"
B_HH04,Fabrics
560129,"Wadding; other articles thereof, other than of cotton or man-made fibres"
B_HH05,Articles of apparel and clothing accesories
560391,"Nonwovens; whether or not impregnated, coated, covered or laminated, not of man-made filaments, (weighing not more than 25g/m2)"
560392,"Nonwovens; whether or not impregnated, coated, covered or laminated, not of man-made filaments, (weighing more than 25g/m2 but not more than 70g/m2)"
560393,"Nonwovens; whether or not impregnated, coated, covered or laminated, not of man-made filaments, (weighing more than 70g/m2 but not more than 150g/m2)"
560394,"Nonwovens; whether or not impregnated, coated, covered or laminated, not of man-made filaments, (weighing more than 150g/m2)"
B_HH06,Blankets and travelling rugs
560890,"Twine, cordage or rope; knotted netting, of other than man-made textiles"
B_HH07,"Bed linen, table linen, toilet linen and kitchen linen"
580190,"Fabrics; woven pile and chenille, of textile materials n.e.c. in heading no. 5801, other than fabrics of heading no. 5802 or 5806"
580300,Gauze; other than narrow fabrics of heading no. 5806
580429,"Lace; mechanically made, of textile materials, (other than man-made fibres), in the piece, in strips or motifs, (other than fabrics of headings 60.02 to 60.06)"
580430,"Lace; hand-made, in the piece, in strips or motifs, (other than fabrics of headings 60.02 to 60.06)"
580500,"Tapestries; hand-woven, (Gobelins, Flanders, Aubusson, Beauvais and the like) and needle-worked tapestries (e.g. petit point, cross-stitch) whether or not made up"
580639,"Fabrics; narrow woven fabrics, n.e.c. in heading no. 5806, of textile materials n.e.c. in item no. 5806.3 (excluding goods of heading no. 5807)"
581010,"Embroidery; without visible ground, in the piece, in strips or in motifs"
581099,"Embroidery; with visible ground, of textile materials (other than cotton and man-made fibres), in the piece, in strips or in motifs"
581100,"Quilted textile products; in the piece, composed of one or more layers of textile materials assembled with padding by stitching or otherwise (excluding embroidery of heading no. 5810)"
590110,"Textile fabrics; coated with gum or amylaceous substances, of a kind used for the outer covers of books or the like"
590190,"Textile fabrics; coated with gum or amylaceous substances, tracing cloth, prepared painting canvas, buckram and similar stiffened textile fabrics for hat foundations, (excluding book covers)"
590410,"Linoleum, whether or not cut to shape"
590490,"Textiles floor coverings; consisting of a coating or covering applied on a textile backing, whether or not cut to shape, other than linoleum"
600129,"Fabrics; looped pile fabrics, of textile materials (other than cotton or man-made fibres), knitted or crocheted"
600199,"Fabrics; pile fabrics (excluding long pile and loop pile), of textile materials (other than cotton or man-made fibres), knitted or crocheted"
600390,"Fabrics; knitted or crocheted fabrics, other than those of heading 60.01 and 60.02, of a width not exceeding 30 cm, other than of wool and fine animal hair, cotton, synthetic or artificial fibres"
600590,"Fabrics; warp knit (including those made on galloon knitting machines), other than those of headings 60.01 to 60.04, excluding those made from cotton or synthetic or artificial fibres"
600690,"Fabrics; knitted or crocheted fabrics, other than those of headings 60.01 to 60.04,and other than those made of wool, fine animal hair, cotton, synthetic or artificial fibres"
B_HH08,"Curtains, interior blinds and valances"
610190,"Coats; men's or boys' overcoats, car-coats, capes, anoraks, wind-jackets and similar articles, of textile materials n.e.c. in heading no. 6101, knitted or crocheted (excluding those of heading no. 6103)"
610290,"Coats; women's or girls' overcoats, car-coats, capes, anoraks, wind-jackets and similar articles, of textile materials n.e.c. in heading no. 6102, knitted or crocheted (excluding those of heading no. 6104)"
610329,"Ensembles; men's or boys', of textile materials (other than cotton or synthetic fibres), knitted or crocheted"
610339,"Jackets and blazers; men's or boys', of textile materials (other than wool or fine animal hair, cotton or synthetic fibres), knitted or crocheted"
610349,"Trousers, bib and brace overalls, breeches and shorts; men's or boys', of textile materials (other than wool or fine animal hair, cotton or synthetic fibres), knitted or crocheted"
610419,"Suits; women's or girls', of textile materials (other than synthetic fibres), knitted or crocheted"
610429,"Ensembles; women's or girls', of textile materials (other than cotton or synthetic fibres), knitted or crocheted"
610439,"Jackets; women's or girls', of textile materials (other than wool or fine animal hair, cotton or synthetic fibres), knitted or crocheted"
610449,"Dresses; women's or girls', of textile materials (other than wool or fine animal hair, cotton, synthetic or artificial fibres), knitted or crocheted"
610459,"Skirts and divided skirts; women's or girls', of textile materials (other than wool or fine animal hair, cotton or synthetic fibres), knitted or crocheted"
610469,"Trousers, bib and brace overalls, breeches and shorts; women's or girls', of textile materials (other than wool or fine animal hair, cotton or synthetic fibres), knitted or crocheted"
610590,"Shirts; men's or boys', of textile materials (other than cotton or man-made fibres), knitted or crocheted"
610690,"Blouses, shirts and shirt-blouses; women's or girls', of textile materials (other than cotton or man-made fibres), knitted or crocheted"
610719,"Underpants and briefs; men's or boys', of textile materials (other than cotton or man-made fibres), knitted or crocheted"
610729,"Nightshirts and pyjamas; men's or boys', of textile materials (other than cotton or man-made fibres), knitted or crocheted"
610799,"Bathrobes, dressing gowns and similar articles; men's or boys', of textile materials (other than cotton), knitted or crocheted"
610819,"Slips and petticoats; women's or girls', of textile materials (other than man-made fibres), knitted or crocheted"
610829,"Briefs and panties; women's or girls', of textile materials (other than cotton or man-made fibres), knitted or crocheted"
610839,"Nightdresses and pyjamas; women's or girls', of textile materials (other than cotton or man-made fibres), knitted or crocheted"
610899,"Negligees, bathrobes, dressing gowns and similar articles; women's or girls', of textile materials (other than cotton or man-made fibres), knitted or crocheted"
610990,"T-shirts, singlets and other vests; of textile materials (other than cotton), knitted or crocheted"
611090,"Jerseys, pullovers, cardigans, waistcoats and similar articles; of textile materials (other than wool or fine animal hair, cotton or man-made fibres), knitted or crocheted"
611190,"Garments and clothing accessories; babies', of textile materials (other than cotton or synthetic fibres), knitted or crocheted"
611219,"Track suits; of textile materials (other than cotton or synthetic fibres), knitted or crocheted"
611239,"Swimwear; men's or boys', of textile materials (other than synthetic fibres), knitted or crocheted"
611249,"Swimwear; women's or girls', of textile materials (other than synthetic fibres), knitted or crocheted"
611490,"Garments; of textile materials (other than cotton or man-made fibres), knitted or crocheted, n.e.c. in chapter 61"
611529,"Hosiery; panty hose and tights (other than graduated compression hosiery), of textile materials (other than synthetic fibres), knitted or crocheted"
611599,"Hosiery and footwear; without applied soles, of textile materials n.e.c. in item no. 6115.9, knitted or crocheted (excluding graduated compression hosiery, panty hose, tights, full or knee-length hosiery measuring per single yarn less than 67 decitex)"
611699,"Gloves, mittens and mitts; of textile materials (other than wool or fine animal hair, cotton or synthetic fibres), knitted or crocheted, (other than impregnated, coated or covered with plastics or rubber)"
611710,"Shawls, scarves, mufflers, mantillas, veils and the like; knitted or crocheted"
620119,"Coats; men's or boys', overcoats, raincoats, car-coats, capes, cloaks and similar articles, of textile materials (other than wool or fine animal hair, cotton or man-made fibres), other than those of heading no. 6203 (not knitted or crocheted)"
B_HH09,Other furnshings
620199,"Anoraks (including ski-jackets), wind-cheaters, wind-jackets and similar articles; men's or boys', of textile materials (other than wool or fine animal hair, cotton or man-made fibres), other than those of heading no. 6203 (not knitted or crocheted)"
620219,"Coats; women's or girls', overcoats, raincoats, car-coats, capes, cloaks and similar articles, of textile materials (other than wool or fine animal hair, cotton or man-made fibres), other than those of heading no. 6204 (not knitted or crocheted)"
620299,"Anoraks (including ski-jackets), wind-cheaters, wind-jackets and similar articles; women's or girls', of textile materials n.e.c. in item no. 6202.9, other than those of heading no. 6204, (not knitted or crocheted)"
620319,"Suits; men's or boys', of textile materials n.e.c. in item no. 6203.1 (not knitted or crocheted)"
620329,"Ensembles; men's or boys', of textile materials n.e.c. in item no. 6203.2 (not knitted or crocheted)"
620339,"Jackets and blazers; men's or boys', of textile materials n.e.c. in item no. 6203.3 (not knitted or crocheted)"
620349,"Trousers, bib and brace overalls, breeches and shorts; men's or boys', of textile materials (other than wool, fine animal hair, cotton or synthetic fibres), (not knitted or crocheted)"
620419,"Suits; women's or girls', of textile materials n.e.c. in item no. 6204.1 (not knitted or crocheted)"
620429,"Ensembles; women's or girls', of textile materials n.e.c. in item no. 6204.2 (not knitted or crocheted)"
620439,"Jackets and blazers; women's or girls', of textile materials n.e.c. in item no. 6204.3 (not knitted or crocheted)"
620449,"Dresses; women's or girls', of textile materials n.e.c. in item no. 6204.4 (not knitted or crocheted)"
620459,"Skirts and divided skirts; women's or girls', of textile materials n.e.c. in item no. 6204.5 (not knitted or crocheted)"
620469,"Trousers, bib and brace overalls, breeches and shorts; women's or girls', of textile materials (other than wool, fine animal hair, cotton or synthetic fibres), (not knitted or crocheted)"
620590,"Shirts; men's or boys', of textile materials n.e.c. in heading no. 6205 (not knitted or crocheted)"
620690,"Blouses, shirts and shirt-blouses; women's or girls', of textile materials n.e.c. in heading no. 6206 (not knitted or crocheted)"
620719,"Underpants and briefs; men's or boys', of textile materials other than cotton (not knitted or crocheted)"
620729,"Nightshirts and pyjamas; men's or boys', of textile materials other than cotton or man-made fibres (not knitted or crocheted)"
620799,"Singlets and other vests, bathrobes, dressing gowns and similar articles; men's or boys', of textile materials other than cotton (not knitted or crocheted)"
620819,"Slips and petticoats; women's or girls', of textile materials other than man-made fibres (not knitted or crocheted)"
620829,"Nightdresses and pyjamas; women's or girls', of textile materials other than cotton or man-made fibres (not knitted or crocheted)"
620899,"Singlets and other vests, briefs, panties, negligees, bathrobes, dressing gowns and similar articles; women's or girls', of textile materials other than cotton or man-made fibres (not knitted or crocheted)"
620990,"Garments and clothing accessories; babies', of textile materials other than cotton or synthetic fibres (not knitted or crocheted)"
